{
  "schemaVersion": 1,
  "id": "H11",
  "kind": "history",
  "rootCause": "copy-pointer-and-manifest-have-no-cross-file-transaction",
  "mastCategory": "verification",
  "source": {
    "path": "docs/acceptance/P34-U09-11.md",
    "revision": "66db1ea03b52237ba499a3c2642a4caf4c6d12f9",
    "lines": [
      94,
      102
    ]
  },
  "evidenceLevel": "SOURCE",
  "status": "SOURCE_ONLY",
  "precondition": "Copy/binding/manifest updates can stop at separate durable steps.",
  "command": "node scripts/deepening/validate-cases.mjs",
  "expected": "Persist replayable intent and verify every copy before committing its pointer; keep unknown windows open.",
  "observed": {
    "original": "Normal cold recovery and partial-batch injection passed; physical kill at pointer/manifest commit was NOT_RUN.",
    "beforeFix": "Normal cold recovery and partial-batch injection passed; physical kill at pointer/manifest commit was NOT_RUN.",
    "afterFix": "NOT_RUN: source-level catalog only; no new runtime claim."
  },
  "regressions": []
}
