{
  "schemaVersion": 1,
  "id": "H13",
  "kind": "history",
  "rootCause": "browser-launch-denied-before-page-entry",
  "mastCategory": "verification",
  "source": {
    "path": "docs/acceptance/P3-P4.md",
    "revision": "66db1ea03b52237ba499a3c2642a4caf4c6d12f9",
    "lines": [
      80,
      80
    ]
  },
  "evidenceLevel": "SOURCE",
  "status": "SOURCE_ONLY",
  "precondition": "Chromium starts in a macOS restricted environment.",
  "command": "node scripts/deepening/validate-cases.mjs",
  "expected": "Record environment FAIL and zero PNGs; never substitute Host/DOM evidence.",
  "observed": {
    "original": "bootstrap_check_in / MachPort permission failure occurred before page.goto.",
    "beforeFix": "bootstrap_check_in / MachPort permission failure occurred before page.goto.",
    "afterFix": "NOT_RUN: source-level catalog only; no new runtime claim."
  },
  "regressions": []
}
