{
  "schemaVersion": 1,
  "id": "H03",
  "kind": "history",
  "rootCause": "static-memory-section-survives-forget",
  "mastCategory": "verification",
  "source": {
    "path": "docs/deepening-proposal.md",
    "revision": "66db1ea03b52237ba499a3c2642a4caf4c6d12f9",
    "lines": [
      9,
      9
    ]
  },
  "evidenceLevel": "UNIT",
  "status": "FIXED",
  "precondition": "A live Agent has already captured a static memory section.",
  "command": "DSH_HOME=\"$PWD/.dsh-dev\" scripts/pnpm -F dsh-bot exec vitest run --config ../../vitest.config.ts tests/deepening/contracts.spec.ts -t \"H03 \"",
  "expected": "Deleting a version stops future injection and preserves a barrier until history/copies are verified.",
  "observed": {
    "original": "Table deletion leaves the old long-lived system section intact; this is the declared private P0.",
    "beforeFix": "Table deletion leaves the old long-lived system section intact; this is the declared private P0.",
    "afterFix": "B4 adds preview CAS, durable stopped/blocked stages, native history replacements and cold recovery. Native system-head grammar, historical session inventory and raw-read outlets remain unverified; FAIL (P0 OPEN). See docs/deepening/B4.md."
  },
  "regressions": [
    {
      "testId": "H03",
      "testFile": "packages/dsh-bot/tests/deepening/contracts.spec.ts",
      "testName": "H03 deleting the table row must revoke a previously assembled static prompt",
      "status": "PASS",
      "receipt": ".dsh-dev/deepening/b2/receipts/H03.json"
    }
  ]
}
