{
  "schemaVersion": 1,
  "id": "H23",
  "kind": "history",
  "rootCause": "typecheck-races-clean-build-artifacts",
  "mastCategory": "verification",
  "source": {
    "path": "docs/acceptance/P2-R06.md",
    "revision": "66db1ea03b52237ba499a3c2642a4caf4c6d12f9",
    "lines": [
      32,
      32
    ]
  },
  "evidenceLevel": "SOURCE",
  "status": "SOURCE_ONLY",
  "precondition": "Typecheck or a profile starts while lib is stale or being cleaned.",
  "command": "node scripts/deepening/validate-cases.mjs",
  "expected": "Run build, test and typecheck in dependency order.",
  "observed": {
    "original": "Old lib still exposed four avatar colors; concurrent clean/typecheck also produced missing declarations.",
    "beforeFix": "Old lib still exposed four avatar colors; concurrent clean/typecheck also produced missing declarations.",
    "afterFix": "NOT_RUN: source-level catalog only; no new runtime claim."
  },
  "regressions": []
}
